{
  "$schema": "https://sf.game.shao.fun/level.schema.json",
  "id": "gui-xu",
  "name": "归墟",
  "tagline": "万风归于墟",
  "win": {
    "title": "归墟可渡",
    "text": "渤海之东，有大壑焉，名曰归墟——万风所归。飞完最后一程，纸飞机也回到风的来处。"
  },
  "world": { "w": 110, "h": 68, "cell": 0.9 },
  "terrain": { "sdf": "smax(min(min(min(flat(62), box(24,42,4,20)), min(circle(62,18,7), 62 - 40*ss((x-80)/4)*ss((102-x)/3) - y)), box(103,44,6,12)), -circle(96,34,6), 2)" },
  "budget": { "hot": 4, "cold": 3 },
  "spawn": { "x": -6, "y": 27, "vx": 26 },
  "goals": [
    { "x": 24, "r": 8 },
    { "x": 62, "r": 6 },
    { "x": 96, "y":40, "r": 4 }
  ],
  "ambient": { "x": 0.9, "y": 0, "temp": -0.08 }
}
