{
  "$schema": "https://sf.game.shao.fun/level.schema-1.json",
  "id": "bing-jiao",
  "name": "冰窖",
  "tagline": "冷沿山坡下沉",
  "win": {
    "title": "踏冷而行",
    "text": "冷空气沉重，顺坡而沉——极地的冰盖也这样刮出下坡风。抵达不总是飞翔，滑行也是一种抵达。"
  },
  "world": { "w": 76, "h": 56, "cell": 0.75 },
  "terrain": { "sdf": "42 - 12*ss((x-14)/5)*ss((26-x)/5) - 16*ss((x-46)/6)*ss((60-x)/6) - y" },
  "budget": { "hot": 1, "cold": 2 },
  "spawn": { "x": -5, "y": 18, "vx": 26 },
  "goals": [{ "x": 62, "r": 6 }],
  "ambient": { "x": 0.8, "y": 0 },
  "fixed": [{ "x": 23, "y": 8, "kind": "cold" }]
}
