{
  "$schema": "https://sf.game.shao.fun/level.schema-1.json",
  "id": "zhuo-yuan",
  "name": "灼原",
  "tagline": "整个世界都想上升",
  "win": {
    "title": "灼原著陆",
    "text": "大地蒸腾着热，着陆成了逆行——在升腾的世界里凿出一方清凉，像探测器顶着上升气流返航。"
  },
  "world": { "w": 76, "h": 56, "cell": 0.75 },
  "terrain": { "sdf": "44 - 20*ss((x-36)/3) + 10*ss((x-58)/6) - y" },
  "budget": { "hot": 1, "cold": 1 },
  "spawn": { "x": -5, "y": 16, "vx": 30 },
  "goals": [
    { "x": 44, "r": 3.5 },
    { "x": 70, "r": 3.5 }
  ],
  "ambient": { "x": 0.4, "y": 0, "temp": 0.5 },
  "fixed": [{ "x": 65, "y": 33, "kind": "hot" }],
  "fans": [{ "x": 34, "y": 10, "dir": 1.57, "power": 22 }]
}
