{
  "$schema": "https://sf.game.shao.fun/level.schema.json",
  "id": "fen-feng",
  "name": "焚风",
  "tagline": "火借风势，风携火威",
  "win": {
    "title": "焚风过境",
    "text": "风扇把火柱吹成一条滚烫的风廊——像阿尔卑斯山脊背的焚风，干热过境，万物沉降，一站接一站。"
  },
  "world": { "w": 76, "h": 56, "cell": 0.75 },
  "terrain": { "sdf": "44 - 20*ss((x-36)/3) + 10*ss((x-58)/6) - y" },
  "budget": { "hot": 2, "cold": 1 },
  "spawn": { "x": -5, "y": 16, "vx": 30 },
  "goals": [
    { "x": 44, "r": 4 },
    { "x": 70, "r": 4 }
  ],
  "ambient": { "x": 0.4, "y": 0 },
  "fixed": [{ "x": 65, "y": 33, "kind": "hot" }],
  "fans": [{ "x": 34, "y": 10, "dir": 1.57, "power": 25 }]
}
