{
  "$schema": "./level.schema-1.json",
  "id": "tian-ti",
  "name": "天梯",
  "tagline": "石柱接天，一阶一重天",
  "win": {
    "title": "拾级凌顶",
    "text": "三根石柱一阶高过一阶，顶上的风又冷又稀。热柱要垒在阶前，冷压要落在阶上——每一级都是一次完整的起降，跌落便是从头再来。"
  },
  "world": { "w": 100, "h": 64, "cell": 0.8 },
  "terrain": { "sdf": "min(flat(60), min(box(26,49,4,11), min(box(48,43,4,17), box(72,37,4,23))))" },
  "budget": { "hot": 4, "cold": 2 },
  "spawn": { "x": -5, "y": 48, "vx": 22 },
  "goals": [
    { "x": 48, "r": 10 },
    { "x": 72, "r": 10 }
  ],
  "ambient": { "x": 0.6, "y": 0, "temp": -0.12 }
}
