{
  "$schema": "./level.schema-1.json",
  "id": "gu-feng",
  "name": "鼓风",
  "tagline": "不等风来，造风而行",
  "win": {
    "title": "御风而行",
    "text": "风可以等来，也可以造出来。扇叶把气流推成一座隐形的桥——站进风口，让它渡你过河。"
  },
  "world": { "w": 76, "h": 56, "cell": 0.75 },
  "terrain": { "sdf": "30 + 14*ss((x-32)/4) - 10*ss((x-40)/4) - y" },
  "budget": { "hot": 2, "cold": 1 },
  "spawn": { "x": -5, "y": 18, "vx": 26 },
  "goals": [{ "x": 64, "r": 7 }],
  "ambient": { "x": 1.8, "y": 0 },
  "fans": [{ "x": 44, "y": 26, "dir": 3.14, "power": 15 }]
}
