{
  "$schema": "https://sf.game.shao.fun/level.schema-1.json",
  "id": "ji-bai",
  "name": "疾摆",
  "tagline": "节拍骤然加密",
  "win": {
    "title": "疾风起舞",
    "text": "钟摆更快、更野，窗口稍纵即逝——疾风里没有犹豫的余裕，起舞要抢在节拍之前。"
  },
  "world": { "w": 76, "h": 56, "cell": 0.75 },
  "terrain": { "sdf": "30 + 14*ss((x-32)/4) - 34*ss((x-40)/4) - y" },
  "budget": { "hot": 2, "cold": 0 },
  "spawn": { "x": -5, "y": 18, "vx": 26 },
  "goals": [{ "x": 54, "r": 6 }],
  "ambient": { "x": 1.8, "y": 0, "temp": -0.2 },
  "fans": [{ "x": 42, "y": 22, "dir": 3.14, "power": 30, "swing": 1.15, "period": 0.9 }]
}
