{
  "$schema": "https://sf.game.shao.fun/level.schema.json",
  "id": "xin-feng",
  "name": "信风",
  "tagline": "风为信使，逐站递送",
  "win": {
    "title": "信已送达",
    "text": "纸飞机是信，风是介质，站点是驿站。信息就这样一站一站传向远方——抵达不是终点，而是下一段路程的起点。"
  },
  "world": { "w": 76, "h": 56, "cell": 0.75 },
  "terrain": { "sdf": "30 - 8*ss((x-20)/16) - y" },
  "budget": { "hot": 3, "cold": 2 },
  "spawn": { "x": -4, "y": 16, "vx": 20 },
  "goals": [
    { "x": 12, "r": 10 },
    { "x": 62, "r": 8 }
  ],
  "ambient": { "x": 1, "y": 0 }
}
