{
  "$schema": "./level.schema-1.json",
  "id": "hui-yin",
  "name": "回音",
  "tagline": "山腹藏着回声",
  "win": {
    "title": "越岭闻声",
    "text": "隧道贯穿山腹，看似捷径，却会错过岭上的站点——回头无风，去路只有一条：把热柱垒上陡壁，越过山顶，再顺风落下。"
  },
  "world": { "w": 100, "h": 64, "cell": 0.8 },
  "terrain": { "sdf": "smax(58 - 36*ss((x-34)/3)*ss((74-x)/3) - y, -capsule(28,46,80,46,8), 2)" },
  "budget": { "hot": 3, "cold": 2 },
  "spawn": { "x": -5, "y": 30, "vx": 24 },
  "goals": [
    { "x": 54, "r": 11 },
    { "x": 88, "r": 11 }
  ],
  "ambient": { "x": 1.1, "y": 0, "temp": -0.1 }
}
